노래제목,가수,가사
사랑에 연습이 있었다면 (Prod. 2soo),임재현,사랑에 연습이 있었다면 우리는 달라졌을까 내가 널 만난 시간 혹은 그 장소 상황이 달랐었다면 우린 맺어졌을까 하필 넌 왜 내가 그렇게 철없던 시절에 나타나서 그렇게 예뻤니 너처럼 좋은 여자가 왜 날 만나서 그런 과분한 사랑 내게 줬는지 우리 다시 그때로 돌아가자는게 그게 미친말인가 정신나간 소린가 나는 더 잘 할 수 있고 다신 울리지 않을 자신있는데 그게 왜 말이 안돼 시간이 너무 흘러 알게되었는데 너를 울리지 않고 아껴주는법 세월은 왜 철없는 날 기다려주지 않고 흘러갔는지 야속해 지금 너 만나는 그에게도 내게 그랬던 것처럼 예쁘게 웃어주니 너처럼 좋은 여자의 사랑 받는 그 남자 너무 부러워 넌 행복하니 니옆에 지금 그 남자가 있는게 우리 다시 맺어질수가 없는 이윤가 나는 더 잘 할 수 있고 다신 울리지 않을 자신있는데 그게 왜 말이 안돼 시간이 너무 흘러 알게 되었는데 너를 울리지 않고 아껴주는 법 세월은 왜 널 잊는 법을 알려주지 않고 흘러갔는지
그때가 좋았어,케이시 (Kassy),이젠 내가 편하니 작은 설렘조차 욕심이겠지 항상 곁에 있어서 계속 함께 있을 줄 알았나 봐 음 반복되는 시간에 지쳐가 더 이상 함께 웃을 일도 없어 봄처럼 따뜻했던 그때가 좋았어 너 하나로 충분했던 그때가 좋았어 헤어지고 나서야 깨닫게 됐어 참 좋았구나 참 예뻤구나 우리 지난날에 그때가 참 좋았어 그때 그때 그때 그때 음 이미 너도 다 알잖아 돌이킬 수 없이 멀리 왔다는 거 억지로 더 노력해도 안되는 건 어쩔 수가 없더라 음 우리 언제 이렇게 됐을까 더는 너를 만날 자신이 없어 봄처럼 따뜻했던 그때가 좋았어 행복해서 눈물 나던 그때가 좋았어 헤어지고 나서야 깨닫게 됐어 참 좋았구나 참 예뻤구나 우리 지난날에 그때가 참 좋았어 가진 것도 없고 초라했어도 서로만으로 충분했으니까 우린 너라서 좋았어 행복했어 사랑이 전부였던 그때가 좋았어 그때 알았더라면 더 사랑할 걸 더 안아줄 걸 후회가 돼 사랑했던 우리가 참 그리워 그때 그때 그때 그때 음
작은 것들을 위한 시 (Boy With Luv) (Feat. Halsey),방탄소년단,모든 게 궁금해 How’s your day Oh tell me 뭐가 널 행복하게 하는지 Oh text me Your every picture 내 머리맡에 두고 싶어 oh bae Come be my teacher 네 모든 걸 다 가르쳐줘 Your 1 your 2 Listen my my baby 나는 저 하늘을 높이 날고 있어 그때 니가 내게 줬던 두 날개로 이제 여긴 너무 높아 난 내 눈에 널 맞추고 싶어 Yeah you makin’ me a boy with luv Oh my my my oh my my my I've waited all my life 네 전부를 함께하고 싶어 Oh my my my oh my my my Looking for something right 이제 조금은 나 알겠어 I want something stronger Than a moment than a moment love I have waited longer For a boy with For a boy with luv 널 알게 된 이후 ya 내 삶은 온통 너 ya 사소한 게 사소하지 않게 만들어버린 너라는 별 하나부터 열까지 모든 게 특별하지 너의 관심사 걸음걸이 말투와 사소한 작은 습관들까지 다 말하지 너무 작던 내가 영웅이 된 거라고 Oh nah 난 말하지 운명 따윈 처음부터 내 게 아니었다고 Oh nah 세계의 평화 No way 거대한 질서 No way 그저 널 지킬 거야 난 Boy with luv Listen my my baby 나는 저 하늘을 높이 날고 있어 그때 니가 내게 줬던 두 날개로 이제 여긴 너무 높아 난 내 눈에 널 맞추고 싶어 Yeah you makin’ me a boy with luv Oh my my my oh my my my You got me high so fast 네 전부를 함께하고 싶어 Oh my my my oh my my my You got me fly so fast 이제 조금은 나 알겠어 Love is nothing stronger Than a boy with luv Love is nothing stronger Than a boy with luv 툭 까놓고 말할게 나도 모르게 힘이 들어가기도 했어 높아버린 sky 커져버린 hall 때론 도망치게 해달라며 기도했어 But 너의 상처는 나의 상처 깨달았을 때 나 다짐했던 걸 니가 준 이카루스의 날개로 태양이 아닌 너에게로 Let me fly Oh my my my oh my my my I've waited all my life 네 전부를 함께하고 싶어 Oh my my my oh my my my Looking for something right 이제 조금은 나 알겠어 I want something stronger Than a moment than a moment love Love is nothing stronger Than a boy with luv
넘쳐흘러,엠씨더맥스 (M.C the MAX),나는 그대를 뒤로한 채로 우리 사랑을 놓아요 차오르는 추억을 헝클어뜨려 모두 일어나지 않았던 일처럼 고갤 저어 모르는 꿈이라 말하고 있네요 남았는지 모를 마음이 나를 향해 힘껏 달려도 어느 끝 멈춰질 그 거리에 그대 다 찢겨져버린 사이 더 기워봐도 다시 그때로 우리 되돌려 놓을 수 없는 그 얘기 날카롭게 패인 이 상처가 깊어 나을 수 없으니 떠나가요 떨궈진 눈물은 가슴에 담아지고 이제 더는 채울 자리 없이 넘쳐흐르네요 그대인지 모를 얼굴이 나를 향해 웃음 지어도 손 내밀 수도 없는 거리에 그대 또 주저앉을 수밖에 무너진 이 사랑과 그대의 모든 흔적을 그리워하는 일만이 더 할 게 없어서 무력해져 가는 내가 싫어 그대를 보내기 싫지만 다 찢겨져버린 사이 더 기워봐도 다시 그때로 우릴 되돌려 놓을 수 없는 그 얘기 날카롭게 패인 이 상처가 깊어 나을 수 없으니 떠나가요
"모든 날, 모든 순간 (Every day, Every Moment)",폴킴,네가 없이 웃을 수 있을까 생각만 해도 눈물이나 힘든 시간 날 지켜준 사람 이제는 내가 그댈 지킬 테니 너의 품은 항상 따뜻했어 고단했던 나의 하루에 유일한 휴식처 나는 너 하나로 충분해 긴 말 안 해도 눈빛으로 다 아니깐 한 송이의 꽃이 피고 지는 모든 날 모든 순간 함께해 햇살처럼 빛나고 있었지 나를 보는 네 눈빛은 꿈이라고 해도 좋을 만큼 그 모든 순간은 눈부셨다 불안했던 나의 고된 삶에 한줄기 빛처럼 다가와 날 웃게 해준 너 나는 너 하나로 충분해 긴 말 안 해도 눈빛으로 다 아니깐 한 송이의 꽃이 피고 지는 모든 날 모든 순간 함께해 알 수 없는 미래지만 네 품속에 있는 지금 순간 순간이 영원 했으면 해 갈게 바람이 좋은 날에 햇살 눈부신 어떤 날에 너에게로 처음 내게 왔던 그날처럼 모든 날 모든 순간 함께해
너를 만나,폴킴,너를 만난 그 이후로 사소한 변화들에 행복해져 눈이 부시게 빛 나는 아침 너를 떠올리며 눈 뜨는 하루 식탁 위에 마주 앉아 너의 하루는 어땠는지 묻거나 나의 하루도 썩 괜찮았어 웃으며 대답해 주고 싶어 별것 아닌 일에 맘이 통할 때면 익숙해진 서로가 놀라웠어 널 사랑해 평온한 지금처럼만 영원하고 싶다고 너를 바라보다 생각했어 너를 만나 참 행복했어 나 이토록 사랑할 수 있었던 건 아직 어리고 모자란 내 맘 따뜻한 이해로 다 안아줘서 무심한 말투에 서로 아플 때면 차가워진 사이가 견딜 수 없어 미안해 불안한 지금이라도 영원하고 싶다고 너를 바라보다 생각했어 너를 만나 참 행복했어 나 이토록 사랑할 수 있었던 건 아직 어리고 모자란 내 맘 따뜻한 이해로 다 안아줘서 뜨거웠던 여름 지나 그리워질 빗소리에 하나 둘 수줍어 또 얼굴 붉히면 생각이 많아진 너의 눈에 입 맞출 테니 우리 함께 걸어가기로 해 나를 만나 너도 행복하니 못 해준 게 더 많아서 미안해 이기적이고 불안한 내가 너에게만은 잘하고 싶었어 오랫동안 나 기다려온 완벽한 사랑을 찾은 것 같아 날 잡아줘서 힘이 돼줘서 소중한 배려로 날 안아줘서 너를 만나
사계 (Four Seasons),태연 (TAEYEON),사계절이 와 그리고 또 떠나 내 겨울을 주고 또 여름도 주었던 온 세상이던 널 보낼래 정말 너를 사랑했을까 언제야 봄이던가 맞아 그땐 한참 서로가 셰익스피어의 연극 같은 마지막이 될 사랑 마주한 듯 둘밖에 안 보였나 봐 다른 걸 좀 보고파 I gave you the world 너만이 전부라 내 겨울을 주고 또 여름도 주었지 뜨겁고 차갑던 그 계절에 정말 너를 사랑했을까 내가 너를 사랑했을까 서로를 그리워했고 서로를 지겨워하지 그 긴 낮과 밤들이 낡아 녹슬기 전에 우리 다시 반짝이자 또 계절이 바뀌잖아 I gave you the world 너만이 전부라 내 겨울을 주고 또 여름도 주었지 뜨겁고 차갑던 그 계절에 정말 너를 사랑했을까 내가 너를 사랑했을까 가도 돼 뒤돌아볼 때쯤엔 난 없어 우리 꽤 괜찮았어 그거면 된 거야 떠날 때 사계절이 와 그리고 또 떠나 내 겨울을 주고 또 여름도 주었던 온 세상이던 널 보낼래 정말 너를 사랑했을까 내가 너를 사랑했을까 내가 너를 사랑했을까
주저하는 연인들을 위해,잔나비,나는 읽기 쉬운 마음이야 당신도 스윽 훑고 가셔요 달랠 길 없는 외로운 마음 있지 머물다 가셔요 음 내게 긴 여운을 남겨줘요 사랑을 사랑을 해줘요 할 수 있다면 그럴 수만 있다면 새하얀 빛으로 그댈 비춰 줄게요 그러다 밤이 찾아오면 우리 둘만의 비밀을 새겨요 추억할 그 밤 위에 갈피를 꽂고선 남몰래 펼쳐보아요 나의 자라나는 마음을 못 본 채 꺾어 버릴 순 없네 미련 남길바엔 그리워 아픈 게 나아 서둘러 안겨본 그 품은 따스할 테니 그러다 밤이 찾아오면 우리 둘만의 비밀을 새겨요 추억할 그 밤 위에 갈피를 꽂고선 남몰래 펼쳐보아요 언젠가 또 그날이 온대도 우린 서둘러 뒤돌지 말아요 마주보던 그대로 뒷걸음치면서 서로의 안녕을 보아요 피고 지는 마음을 알아요 다시 돌아온 계절도 난 한 동안 새 활짝 피었다 질래 또 한번 영원히 그럼에도 내 사랑은 또 같은 꿈을 꾸고 그럼에도 꾸던 꿈을 난 또 미루진 않을거야
니 소식,송하예,그때의 우리 사랑 뜨겁고 치열했는데 끝나보니 남는건 미움뿐 몇번의 계절을 더 보내야 괜찮아 질까 미련이 듬뿍 남은 하루를 보내 친구들과 통화에 우연히 들은 니 소식 다른 사랑을 시작해 잘 지낸다고 한땐 소중했었고 많이 사랑했었던 우리둘은 이젠 남이 됐고 모르는 사람이야 넌 완벽히 잊었나봐 이렇게 넌 잘사는데 괜한 걱정을 했나봐 나만 힘든가봐 너도 내 소식을 전해 들었으면 좋겠어 아직은 좀 힘들어 한다는 미안한 마음갖고 가끔씩 날 생각해줘 그래야 내 맘이 좀 편할거 같아 니옆에 다른 사람 있다는게 참 낯설어 뭔지 모를 서운함은 이기적인 거니 한땐 소중했었고 많이 사랑했었던 우리둘은 이젠 남이 됐고 모르는 사람이야 넌 완벽히 잊었나봐 이렇게 넌 잘사는데 나만 끝을 미뤘나봐 나만 그랬나봐 솔직한 맘을 말하면 좋은 사랑 안했으면 해 가슴아프게 지내길 바랬어 너는 행복하겠지 많이 설레이겠지 나 없이도 웃는 니 모습에 이제야 실감이나 넌 완벽히 떠났나봐 확실히 날 떠났나봐 난 니가 너무 미워져 행복하지 말아줘 잘지내지 말아줘 좋은 사람 만나 다행이란 말은 거짓말이야 네 소식 들은 그날밤 펑펑 울다가 밤을 샜어 늦어버린걸 알지만 어쩔수 없나봐
오늘도 빛나는 너에게 (To You My Light) (Feat.이라온),마크툽 (MAKTUB),별빛이 내린 밤 그 풍경 속 너와 나 날 새롭게 하는 따뜻하게 만드는 니 눈빛 니 미소 영원히 담아둘게 너로 가득한 맘 널 닮아가는 나 날 위한 선물 꿈보다 더 아름다운 서로의 품에서 끝 없는 밤을 걷자 나의 모든 날들을 다 주고싶어 내 이 맘을 모두 전하고 싶어 잠들지 못한 푸른 바람들 이렇게 밝게 이 밤을 비춰 너와 작은 일상을 함께 하는게 내 가장 큰 기쁨인걸 넌 알까 내 세상 속에 넌 빛이 되어 지금 모습 그대로 내 곁에만 행복이 짙은 날 어둠이 없는 밤 같은 맘 속에 같은 꿈이 피어난 건 우리의 정해진 운명이 맞닿은거야 나의 모든 날들을 다 주고싶어 내 이 맘을 모두 전하고 싶어 잠들지 못한 푸른 바람들 이렇게 밝게 이 밤을 비춰 너와 작은 일상을 함께 하는게 내 가장 큰 기쁨인걸 넌 알까 내 세상 속에 넌 빛이 되어 지금 모습 그대로 내 곁에만 내게 온 너란 빛이 눈 부셔도 네 앞에서 한 순간도 눈 감지 않아 다가올 시간도 계절의 바람도 널 데려가지 못하게 내가 더 좋은 사람이 되고 싶어 더 아름답게 널 안을 수 있게 잠들지 못한 잠들 수 없는 바람들이 널 부르고 있어 언제까지나 너와 함께 할거야 내 마지막 숨결도 너일거야 내 세상 속에 넌 빛이 되어 지금 모습 그대로 내 곁에만 이렇게 밝게 이 밤을 비춰
벌써 12시,청하,Yeah I like it 네가 말을 놓는 것도 Like it 너의 작은 말투도 나쁘지 않은걸 Boy you know know know know Like the way 말없이 손을 잡고 Like the way 조금은 놀래도 싫지가 않은걸 You know boy boy boy boy 물감처럼 파랗던 하늘은 벌써 까맣고 감정은 더 깊어져 yeah I gotta tell you this 우리 둘만 느껴지는 이상한 느낌 나도 너무 좋아 but it’s too late 아쉬워 벌써 12시 어떡해 벌써 12시네 보내주기 싫은걸 알고 있어 how you feel it 음악에 맞춰 사랑을 속삭이고 싶어 솔직히 우리 둘 맘이 같은 걸 Gotta go gotta go 12시 같은 생각인 걸 알고 있는데 더 이상은 솔직할 수 없는 걸 Gotta go gotta go 12시 어쩜 우린 닮은 것도 많아 취향 취미 먹을 때도 말야 You’re reading my heart 좀 더 일찍 알았다면 어땠을까 생각하게 돼 yeah 별들은 더 빛나고 시간은 점점 지나고 감성은 더 짙어져 yeah I gotta tell you this 너에게만 느껴지는 포근한 느낌 나도 너무 좋아 but it’s too late 아쉬워 벌써 12시 어떡해 벌써 12시네 보내주기 싫은 걸 알고 있어 how you feel it 음악에 맞춰 사랑을 속삭이고 싶어 솔직히 우리 둘 맘이 같은 걸 Gotta go gotta go 12시 같은 생각인 걸 알고 있는데 더 이상은 솔직할 수 없는 걸 Gotta go gotta go 12시 구석에 맘 한구석에 조그만 끈 붙잡고 있는 걸 Baby don’t wanna be alone 늦으면 더 늦어지면 어쩌면 다 놓아버릴지 몰라 I’m really trying to make you see 아쉬워 벌써 12시 어떡해 벌써 12시네 보내주기 싫은걸 알고 있어 how you feel it Gotta go gotta go 12시
술이 문제야,"장혜진, 윤민수(바이브)",그리워서 한 잔 생각나서 한 잔 내 눈물 섞어 한 잔 또 한 잔 마시다 우리 옛 추억에 취해 독한 네 사랑에 취해 너의 전화 번홀 누르게 돼 아마 받지 않겠지만 미안해 술이 문제야 문제 자꾸 너를 떠올리게 해 술이 문제야 문제 자꾸 네가 생각나게 해 정말 미친 듯이 보고 싶어 한 잔 정말 미친 듯이 그리워서 한 잔 한 잔 두 잔 기울이면 너의 기억 모두 끊어질까 봐 술 한잔했어요 잊어보려 한 잔 지워보려 한 잔 내 눈물 섞어 한 잔 또 한 잔 마시다 흐릿한 얼굴에 취해 희미한 기억에 취해 다시 전화 번홀 누르게 돼 절대 받지 않겠지만 미안해 술이 문제야 문제 자꾸 너를 떠올리게 해 술이 문제야 문제 자꾸 네가 생각나게 해 정말 미친 듯이 보고 싶어 한 잔 정말 미친 듯이 그리워서 한 잔 한 잔 두 잔 기울이면 너의 기억 모두 끊어질까 봐 나 맨정신에 살 수 없어서 술 한잔했어요 나 제정신에 살 수 없어서 술 한잔했어요 딱 한 잔만 딱 한 잔만 딱 한 잔만 더 마시면 너 돌아올까 봐 미안해 다 내가 문제야 문제 바보같이 널 또 기다려 아니야 내가 문제야 문제 아직까지 너만 사랑해 정말 보고 싶은 너를 위해 한 잔 정말 사랑했던 우릴 위해 한 잔 한 잔 두 잔 기울이면 너의 기억 모두 끊어질까 봐 술 한잔했어요
옥탑방 (Rooftop),엔플라잉 (N.Flying),너는 별을 보자며 내 몸을 당겨서 단 한 번에 달빛을 내 눈에 담았어 Every time I look up in the sky 근데 단 한 개도 없는 Star 혼자 두지 않을게 저 달이 외롭지 않게 해 줘 너는 별을 보자며 내 손을 끌어서 저녁노을이 진 옥상에 걸터앉아 Every time I look up in the sky 근데 단 한 개도 없는 Star 괜찮아 네가 내 우주고 밝게 빛나 줘 이런 가사 한 마디가 널 위로한다면 나 펜을 잡을게 자극적인 것보다 진심만으로 말할 수 있어 All day 고양이보다 넌 강아지같이 날 기다렸지 하루 종일 뭐가 그리 슬펐지 이 별에서 네가 가장 특별해 너는 그런 거 전혀 몰랐지 You want some more 왜 자꾸만 널 가두려 하는 건지 You want some more Sky is nothing to believe 너는 별을 보자며 내 손을 끌어서 저녁노을이 진 옥상에 걸터앉아 Every time I look up in the sky 근데 단 한 개도 없는 Star 괜찮아 네가 내 우주고 밝게 빛나 줘 있잖아 난 네가 아주 가끔씩 무겁게 할 때마다 움칫 널 위로할 손이 난 없네 지금 난 갈 길을 잃은 별 날 당기는 힘은 너 넌 별을 잃은 하늘처럼 떠돌고 다녀 우리가 지난 길이 별자리처럼 나와 너 그 길을 따라서 날 기억해줘 You want some more 왜 자꾸만 널 가두려 하는 건지 You want some more Sky is nothing to believe 너는 별을 보자며 내 손을 끌어서 저녁노을이 진 옥상에 걸터앉아 Every time I look up in the sky 근데 단 한 개도 없는 Star 괜찮아 네가 내 우주고 밝게 빛나 줘 Girl I don’t know why I’m leaving Girl I don’t know why 처음부터 다시 알려 줘 Girl I don’t know why I’m leaving Girl I don’t know why 너는 별을 보자며 내 손을 끌어서 저녁노을이 진 옥상에 걸터앉아 Every time I look up in the sky 근데 단 한 개도 없는 Star 괜찮아 네가 내 우주고 밝게 빛나 줘 꼭 닮은 너를 찾아 나섰지 너를 당겨 보려 해도 Every time I look up in the sky 근데 단 한 개도 없는 Star 괜찮아 네가 내 우주고 밝게 빛나 줘
달라달라,ITZY (있지),DDA DDA LA DDA LA DDA LA People look at me and they tell me 외모만 보고 내가 날라리 같대요 So what 신경 안 써 I'm sorry I don't care don't care really don't care because 사랑 따위에 목매지 않아 세상엔 재밌는 게 더 많아 언니들이 말해 철들려면 멀었대 I'm sorry sorry 철들 생각 없어요 예쁘기만 하고 매력은 없는 애들과 난 달라 달라 달라 DDA DDA LA DDA LA 네 기준에 날 맞추려 하지 마 난 지금 내가 좋아 나는 나야 DDA DDA LA DDA LA DDA LA I love myself 난 뭔가 달라 달라 YEAH I love myself 난 뭔가 달라 달라 YEAH 난 너랑 달라 달라 YEAH Bad bad I'm sorry I'm bad I'm just the way I am 남 신경 쓰고 살긴 아까워 하고 싶은 일 하기도 바빠 My life 내 맘대로 살 거야 말리지 마 난 특별하니까 YEAH 남들의 시선 중요치 않아 내 style이 좋아 그게 나니까 언니들이 말해 내가 너무 당돌하대 I'm sorry sorry 바꿀 생각 없어요 Nope 예쁘기만 하고 매력은 없는 애들과 난 달라 달라 달라 DDA DDA LA DDA LA 네 기준에 날 맞추려 하지 마 난 지금 내가 좋아 나는 나야 DDA DDA LA DDA LA DDA LA Don’t care what people say 나는 내가 알아 I’m talkin' to myself 기죽지 마 절대로 고개를 들고 네 꿈을 쫓아 Just keep on dreamin' Keep your chin up We got your back Keep your head up Just keep on dreamin' Keep your chin up We got your back Keep your head up Just keep on dreamin' 예쁘기만 하고 매력은 없는 애들과 난 달라 달라 달라 DDA DDA LA DDA LA 네 기준에 날 맞추려 하지 마 난 지금 내가 좋아 나는 나야 DDA DDA LA DDA LA DDA LA I love myself 난 뭔가 달라 달라 YEAH I love myself 난 뭔가 달라 달라 YEAH 난 너랑 달라 달라 YEAH
노래방에서,장범준,나는 사랑이 어떻게 이뤄지는 지 연구 했지 여러가지 상황의 수를 계산 해 봤지 그땐 내가 좀 못 생겨서 흑흑 니가 좋아하는 노랠 알아내는 것은 필수 가성이 많이 들어가서 마이크 조절이 굉장히 조심스러웠었지 그렇게 노래방으로 가서 그녀가 좋아하는 노랠해 무심한 척 준비안한 척 노랠 불렀네 어어 그렇게 내가 노랠 부른뒤 그녀의 반응을 상상하고 좀더 잘 불러볼걸 노랠 흥얼 거렸네 사랑때문에 노랠 연습하는 건 자연의 이치 날으는 새들도 모두 사랑노래 부르는 게 뭔가 가능성만 열어 준다면 근데 그년 남자친구가 있었지 그것은 내 실수 그 후로 혼자 노래방에서 복잡한 맘을 달랬네 몇 달을 혼자 노래방에 갔는지 그렇게 노래방이 취미가 되고 그녀가 좋아하는 노랠해 괜찮은 척 안슬픈 척 노랠 불렀네 어어 그렇게 내가 노랠 부른뒤 우연히 집에 가려 하는데 갑자기 그녀가 노래방에 가자 하네 그렇게 나는 그녀를 따라 걸어보지만 괜찮은 척 사실 난 너무 많이 떨려요 그녀 아무렇지 않아도 나는 아무렇지 않지 않아요 근데 그녀는 나를 바라보고는 자기도 지금 아무 렇지 않지 않대요 무슨 말이 냐고 물어보네 그렇게 노래방을 나오고 그녀를 집에 데려다 준뒤 무슨일 인가 괜찮은 건가 멍해 버렸네 어어 핸드폰도 없는 늦은 새벽 집에서 계속 잠은 안오고 그녀가 좋아하던 노랠 흥얼 거렸네 그녀가 좋아하던 노랠 흥얼 거렸네
이 노래가 클럽에서 나온다면,우디 (Woody),이 노래가 클럽에서 나온다면 네가 이 음악에 춤출 수 있을까요 이 노래가 클럽에서 나온다면 혹시 그녀가 내게 전화할까요 이 노래가 흘러 네게 닿는다면 그대는 웃을까요 눈물 흘릴까요 궁금하죠 과연 You still have fire You still have fire 해가 지고 나서 눈이 떠진 날 침대가 너무 넓다고 느껴진 날 베개 하나가 할 일을 잃은 날 잠깐만 오늘 꿈에서 널 본 것 같아 난 한 번 더 보려고 눈을 감네 But I can do a nothing 적적한 마음에 떠날 거라면 이 맘도 가져가 어차피 넌 내 말 듣지 않을 거니까 이 노래가 클럽에서 나온다면 네가 이 음악에 춤출 수 있을까요 이 노래가 클럽에서 나온다면 혹시 그녀가 내게 전화할까요 이 노래가 흘러 네게 닿는다면 그대는 웃을까요 눈물 흘릴까요 궁금하죠 과연 과연 You still have fire fire Fire up fire up fire up You still have fire You still have fire Fire up fire up fire up You still have fire You still have fire Fire up fire up fire up You still have fire You still have fire 궁금하죠 과연 과연 You still have fire fire 그래 네가 맞아 네가 했던 말 다 맞는 말이고 이미 떠나보낸 막차 내가 전화해도 너는 받질 않아 손을 뻗어봤자 전혀 널 지워 버리려고 해 술에 힘을 빌려 Oh oh But 또 가지 널 만나러 꿈속으로 3 2 1 이 노래가 클럽에서 나온다면 네가 이 음악에 춤출 수 있을까요 이 노래가 클럽에서 나온다면 혹시 그녀가 내게 전화할까요 이 노래가 흘러 네게 닿는다면 그대는 웃을까요 눈물 흘릴까요 궁금하죠 과연 과연 You still have fire fire 걸어와 줘 넌 내게로 여전히 넌 예쁜 채로 내 곁에 있어 내 옆에 있어 아직도 멈춘 시간 그곳에 있어 내 노래가 들리면 지금 전화해줘 1 2 3 이 노래가 클럽에서 나온다면 네가 이 음악에 춤출 수 있을까요 이 노래가 클럽에서 나온다면 혹시 그녀가 내게 전화할까요 이 노래가 흘러 네게 닿는다면 그대는 웃을까요 눈물 흘릴까요 궁금하죠 과연 과연 You still have fire fire Fire up fire up fire up You still have fire You still have fire Fire up fire up fire up You still have fire You still have fire Fire up fire up fire up You still have fire You still have fire 궁금하죠 과연 과연 You still have fire fire
